comment_id,post_id,body,score,created_utc,subreddit,body_clean,kiq_label,_llm_text,is_relevant,sentiment_label,sentiment_score,reason
o8txwhg,1rljafg,"This 100%, we are just straight up strapping cameras to our heads at this point for them.",4,2026-03-05,technology,"this 100 , we are just straight up strapping cameras to our heads at this point for them.",KIQ_3_2,"This 100%, we are just straight up strapping cameras to our heads at this point for them.",True,negative,-0.7,"The comment expresses strong apprehension about the concept of wearing cameras, which relates to facial recognition technology."
ocwv0nr,1s5jzrd,"Facial recognition and not obvious recording is crazy, they really should be banned. what a privacy nightmare. even recently, one of the greatest ufc fighters (jon jones) had their arthritis leaked by some doofus recording their convo with these glasses. unfortunately, we live in a shithole that allows this trash.",13,2026-03-28,technology,"facial recognition and not obvious recording is crazy, they really should be banned. what a privacy nightmare. even recently, one of the greatest ufc fighters jon jones had their arthritis leaked by some doofus recording their convo with these glasses. unfortunately, we live in a shithole that allows this trash.",KIQ_3_2,"Facial recognition and not obvious recording is crazy, they really should be banned. what a privacy nightmare. even recently, one of the greatest ufc fighters (jon jones) had their arthritis leaked by some doofus recording their convo with these glasses. unfortunately, we live in a shithole that allows this trash.",True,negative,-0.8,The comment expresses strong negative sentiment regarding facial recognition and privacy concerns related to recording.
ocz2llg,1s5jzrd,First they gladly earn from scammers buying adds on facebook and now they are monetizing creeps and predator. What a twisted timeline. ,2,2026-03-28,technology,first they gladly earn from scammers buying adds on facebook and now they are monetizing creeps and predator. what a twisted timeline.,KIQ_3_2,First they gladly earn from scammers buying adds on facebook and now they are monetizing creeps and predator. What a twisted timeline. ,True,negative,-0.8,"The comment criticizes Meta's monetization strategy, implying the facial recognition feature is being used to profit from negative actors."
n9saz1j,1mvrvxh,"one should sue someone in front of him, that uses these glasses",23,2025-08-20,privacy,"one should sue someone in front of him, that uses these glasses",KIQ_3_2,"one should sue someone in front of him, that uses these glasses",True,negative,-0.7,The comment implies a negative reaction or discomfort regarding the use of the glasses' features.
n9sxr4k,1mvrvxh,What exactly do the people who come up with this shit expect to happen,15,2025-08-20,privacy,what exactly do the people who come up with this shit expect to happen,KIQ_3_2,What exactly do the people who come up with this shit expect to happen,True,negative,-0.7,The aggressive tone suggests strong disapproval of the feature being discussed (implied to be Name Tag/facial recognition).
n9uo40i,1mvrvxh,"I think they think they will have their own personal Jarvis on call,googling topics on the fly, searching whoever they are talking to's past history etc

Instead of following social protocols of slowly unwrapping yourself, developing interests and just not knowing certain things and letting the person you are speaking to passionately explain,I think they want these glasses to be like the suite from the jackie chans spy comedy ""the suite"", a device that when switched on makes you the most intelligent,swav , elegant person in the world.

What will actually happen, as the more these are used especially in bars or places people expect privacy you will come of like a nons, somebody so socially inept they need glasses to help them or (what I hope happens) you come off like a pervert recording always. Like Japan I see heavy crack downs on these. Their will be signs in schools,bars,hospitals, homes etc that those glasses are not permissible. Its will be seen as date red flag that someone might be actively recording you,face scanning you and googling while talking.

Rip guys who wear prescription glasses,gonna be tough with people wondering are you one of them glasses ai pervs.",5,2025-08-21,privacy,"i think they think they will have their own personal jarvis on call,googling topics on the fly, searching whoever they are talking to's past history etc instead of following social protocols of slowly unwrapping yourself, developing interests and just not knowing certain things and letting the person you are speaking to passionately explain,i think they want these glasses to be like the suite from the jackie chans spy comedy the suite , a device that when switched on makes you the most intelligent,swav , elegant person in the world. what will actually happen, as the more these are used especially in bars or places people expect privacy you will come of like a nons, somebody so socially inept they need glasses to help them or what i hope happens you come off like a pervert recording always. like japan i see heavy crack downs on these. their will be signs in schools,bars,hospitals, homes etc that those glasses are not permissible. its will be seen as date red flag that someone might be actively recording you,face scanning you and googling while talking. rip guys who wear prescription glasses,gonna be tough with people wondering are you one of them glasses ai pervs.",KIQ_3_2,"I think they think they will have their own personal Jarvis on call,googling topics on the fly, searching whoever they are talking to's past history etc

Instead of following social protocols of slowly unwrapping yourself, developing interests and just not knowing certain things and letting the person you are speaking to passionately explain,I think they want these glasses to be like the suite from the jackie chans spy comedy ""the suite"", a device that when switched on makes you the most intelligent,swav , elegant person in the world.

What will actually happen, as the more these are used especially in bars or places people expect privacy you will come of like a nons, somebody so socially inept they need glasses to help them or (what I hope happens) you come off like a pervert recording always. Like Japan I see heavy crack downs on these. Their will be signs in schools,bars,hospitals, homes etc that those glasses are not permissible. Its will be seen as date red flag that someone might be actively recording you,face scanning you and googling while talking.

Rip guys who wear prescription glasses,gonna be tough with people wondering are you one of them glasses ai pervs.",True,negative,-0.7,Expresses strong negative concerns about privacy invasion and social awkwardness caused by facial recognition.
ne5yd8g,1ngrgay,I've noticed a lot of new social media content involves filming people with these in various situations without them knowing what they are. It's gross,114,2025-09-14,privacy,i've noticed a lot of new social media content involves filming people with these in various situations without them knowing what they are. it's gross,KIQ_3_2,I've noticed a lot of new social media content involves filming people with these in various situations without them knowing what they are. It's gross,True,negative,-0.7,"The comment expresses disgust regarding being filmed without consent, which relates to the privacy implications of facial recognition features."
ne5zo41,1ngrgay,What if I don’t have a facebook account? Or no photos on any meta account? Are there more details to this?,34,2025-09-14,privacy,what if i don t have a facebook account? or no photos on any meta account? are there more details to this?,KIQ_3_2,What if I don’t have a facebook account? Or no photos on any meta account? Are there more details to this?,True,neutral,0.0,The comment directly questions the functionality and requirements (like having a Facebook account) for Meta's identification features.
ne62jv8,1ngrgay,"Honestly, I wouldn't be surprised if they are tracking pseudo anonymous people as well. Those people have friends, and quite likely those friends posted group photos online which included them and also tagged the photos. Then there are situations where thousands of tourists film stuff constantly, like in the city I'm at. I dread to think how many photos and videos were captured of me walking past in the background. That stuff gets uploaded somewhere, and no doubt corporate surveillance systems will analyse and record every face appearing in those pictures and correlate them with other data. This shit is grim.",9,2025-09-14,privacy,"honestly, i wouldn't be surprised if they are tracking pseudo anonymous people as well. those people have friends, and quite likely those friends posted group photos online which included them and also tagged the photos. then there are situations where thousands of tourists film stuff constantly, like in the city i'm at. i dread to think how many photos and videos were captured of me walking past in the background. that stuff gets uploaded somewhere, and no doubt corporate surveillance systems will analyse and record every face appearing in those pictures and correlate them with other data. this shit is grim.",KIQ_3_2,"Honestly, I wouldn't be surprised if they are tracking pseudo anonymous people as well. Those people have friends, and quite likely those friends posted group photos online which included them and also tagged the photos. Then there are situations where thousands of tourists film stuff constantly, like in the city I'm at. I dread to think how many photos and videos were captured of me walking past in the background. That stuff gets uploaded somewhere, and no doubt corporate surveillance systems will analyse and record every face appearing in those pictures and correlate them with other data. This shit is grim.",True,negative,-0.8,"Expresses deep concern about pervasive facial tracking and corporate surveillance, directly related to recognition technology."
ne6388q,1ngrgay,"Good lord, knock it off with the doomsday talk. Privacy as an entire realm of topics is certainly not dead. Those glasses can’t look at you and break your encrypted communications or see your browser history, or whatever. And facial recognition from videos has been around for a long time. Additionally, when you’re out in public you have no assumption of privacy with regards to photos of you. 

Is it good? No. Is it the end of privacy? Also no.",1,2025-09-14,privacy,"good lord, knock it off with the doomsday talk. privacy as an entire realm of topics is certainly not dead. those glasses can t look at you and break your encrypted communications or see your browser history, or whatever. and facial recognition from videos has been around for a long time. additionally, when you re out in public you have no assumption of privacy with regards to photos of you. is it good? no. is it the end of privacy? also no.",KIQ_3_2,"Good lord, knock it off with the doomsday talk. Privacy as an entire realm of topics is certainly not dead. Those glasses can’t look at you and break your encrypted communications or see your browser history, or whatever. And facial recognition from videos has been around for a long time. Additionally, when you’re out in public you have no assumption of privacy with regards to photos of you. 

Is it good? No. Is it the end of privacy? Also no.",True,neutral,0.1,"It discusses facial recognition in public settings, directly addressing the privacy concerns surrounding the technology."
ne6485r,1ngrgay,"""you have no assumption of privacy"" 🙄",3,2025-09-14,privacy,you have no assumption of privacy,KIQ_3_2,"""you have no assumption of privacy"" 🙄",True,negative,-0.8,"The comment directly implies a lack of privacy regarding the technology, strongly suggesting concern over facial recognition."
ne65xct,1ngrgay,"it found not only my pictures from two previous employers websites (neither of which were on any public facing pages), but also a picture of *me in the background* of some tourist’s photo on the czech equivalent of flickr, wearing a hollister shirt i haven’t seen since 2014",7,2025-09-14,privacy,"it found not only my pictures from two previous employers websites neither of which were on any public facing pages , but also a picture of me in the background of some tourist s photo on the czech equivalent of flickr, wearing a hollister shirt i haven t seen since 2014",KIQ_3_2,"it found not only my pictures from two previous employers websites (neither of which were on any public facing pages), but also a picture of *me in the background* of some tourist’s photo on the czech equivalent of flickr, wearing a hollister shirt i haven’t seen since 2014",True,negative,-0.8,"The user describes unauthorized and intrusive facial recognition finding private images, indicating a negative experience with the feature."
ne67bvf,1ngrgay,How do you identify people within seconds?,3,2025-09-14,privacy,how do you identify people within seconds?,KIQ_3_2,How do you identify people within seconds?,True,neutral,0.0,"The question directly probes the capability of rapid identification, which relates to facial recognition features like Name Tag."
ne69mq0,1ngrgay,"It’s one thing to be seen in public. It’s a whole other thing when you have people walking around with smart glasses, contacts, etc, or whatever else there will be in the future, that some people will almost certainly abuse.",1,2025-09-14,privacy,"it s one thing to be seen in public. it s a whole other thing when you have people walking around with smart glasses, contacts, etc, or whatever else there will be in the future, that some people will almost certainly abuse.",KIQ_3_2,"It’s one thing to be seen in public. It’s a whole other thing when you have people walking around with smart glasses, contacts, etc, or whatever else there will be in the future, that some people will almost certainly abuse.",True,negative,-0.5,Expresses concern about the potential abuse of future surveillance technology like smart glasses.
o578lgk,1r3vja0,It’s like a Ring door camera everyone wears. What could possibly go wrong!?,281,2026-02-13,privacy,it s like a ring door camera everyone wears. what could possibly go wrong!?,KIQ_3_2,It’s like a Ring door camera everyone wears. What could possibly go wrong!?,True,negative,-0.7,"Compares the feature to a surveillance device (Ring camera), implying privacy concerns about facial recognition."
o579w4p,1r3vja0,"Oooh, will it connect into the TSA, I mean ICE data base?",43,2026-02-13,privacy,"oooh, will it connect into the tsa, i mean ice data base?",KIQ_3_2,"Oooh, will it connect into the TSA, I mean ICE data base?",True,negative,-0.5,"The comment raises concerns about linking facial recognition to government databases (TSA/ICE), indicating distrust."
o57a36f,1r3vja0,"Oooh, will it connect with the TSA or is that ICE database??",1,2026-02-13,privacy,"oooh, will it connect with the tsa or is that ice database??",KIQ_3_2,"Oooh, will it connect with the TSA or is that ICE database??",True,neutral,0.1,"It questions the scope of facial recognition, linking it to government databases, which relates to the feature's implications."
o57dov5,1r3vja0,This is a great way to make sure no one ever wants to be around you.,111,2026-02-13,privacy,this is a great way to make sure no one ever wants to be around you.,KIQ_3_2,This is a great way to make sure no one ever wants to be around you.,True,negative,-0.7,"The comment implies the feature is socially isolating or undesirable, suggesting negative sentiment toward the concept."
o57rpqc,1r3vja0,Paywall. Wondering if this would be limited to just meta members or if their ai will comb the internet for results.,2,2026-02-13,privacy,paywall. wondering if this would be limited to just meta members or if their ai will comb the internet for results.,KIQ_3_2,Paywall. Wondering if this would be limited to just meta members or if their ai will comb the internet for results.,True,neutral,0.0,"The comment questions the scope of the AI's search capabilities, which relates to how facial recognition might function."
o57tjc2,1r3vja0,"I’m faceblind, and it would really help me figure out who I’m talking to.

But also, hell the fuck no. I can live with not being able to recognize people. Not that I’d ever get Meta glasses to start with.",16,2026-02-13,privacy,"i m faceblind, and it would really help me figure out who i m talking to. but also, hell the fuck no. i can live with not being able to recognize people. not that i d ever get meta glasses to start with.",KIQ_3_2,"I’m faceblind, and it would really help me figure out who I’m talking to.

But also, hell the fuck no. I can live with not being able to recognize people. Not that I’d ever get Meta glasses to start with.",True,neutral,0.0,"The comment discusses the utility and personal aversion to facial recognition, directly addressing the core topic."
o57z8ki,1r3vja0,"Oh yeah, for quality assurance of course!

Or to comply with a new workplace regulation that got passsed by some meta paid off legislators.

Ah fun times ...",10,2026-02-13,privacy,"oh yeah, for quality assurance of course! or to comply with a new workplace regulation that got passsed by some meta paid off legislators. ah fun times ...",KIQ_3_2,"Oh yeah, for quality assurance of course!

Or to comply with a new workplace regulation that got passsed by some meta paid off legislators.

Ah fun times ...",True,negative,-0.7,"The comment implies surveillance or forced compliance regarding a feature, suggesting negative sentiment toward its implementation."
o584n41,1r3vja0,"*Meta says it will launch the feature “during a dynamic political environment where many civil society groups that we would expect to attack us would have their resources focused on other concerns.”*

Premeditated attack on privacy. What a bunch of weasels.",33,2026-02-13,privacy,meta says it will launch the feature during a dynamic political environment where many civil society groups that we would expect to attack us would have their resources focused on other concerns. premeditated attack on privacy. what a bunch of weasels.,KIQ_3_2,"*Meta says it will launch the feature “during a dynamic political environment where many civil society groups that we would expect to attack us would have their resources focused on other concerns.”*

Premeditated attack on privacy. What a bunch of weasels.",True,negative,-0.8,"The comment criticizes Meta's timing of a feature, implying a premeditated attack on privacy."
o58brgt,1r3vja0,"So how long until they get to comb government databases for people who don’t have public social media? You know, just to make sure everyone is up front and honest, can’t have random strangers hiding their identity from you can we? Maybe we can even have their profiles automatically pull up as you walk by!",6,2026-02-13,privacy,"so how long until they get to comb government databases for people who don t have public social media? you know, just to make sure everyone is up front and honest, can t have random strangers hiding their identity from you can we? maybe we can even have their profiles automatically pull up as you walk by!",KIQ_3_2,"So how long until they get to comb government databases for people who don’t have public social media? You know, just to make sure everyone is up front and honest, can’t have random strangers hiding their identity from you can we? Maybe we can even have their profiles automatically pull up as you walk by!",True,negative,-0.8,Expresses strong concern and distrust regarding invasive facial recognition and data scraping capabilities.
o58gfv5,1r3vja0,"Welcome to the panopticon, guys. Fucking awful.",10,2026-02-13,privacy,"welcome to the panopticon, guys. fucking awful.",KIQ_3_2,"Welcome to the panopticon, guys. Fucking awful.",True,negative,-0.9,"The term 'panopticon' strongly implies surveillance and distrust, directly relating to facial recognition technology."
o58gq8i,1r3vja0,"Sure, state security will be able to access facial (and other) recognition logs without a warrant.",6,2026-02-13,privacy,"sure, state security will be able to access facial and other recognition logs without a warrant.",KIQ_3_2,"Sure, state security will be able to access facial (and other) recognition logs without a warrant.",True,negative,-0.7,"It discusses the potential for state security access to facial recognition logs, implying privacy concerns about the feature."
o58tonc,1r3vja0,"Sure. Add face recognition. That’s not a violation of privacy, but the LED not being on…how dare you!",3,2026-02-13,privacy,"sure. add face recognition. that s not a violation of privacy, but the led not being on how dare you!",KIQ_3_2,"Sure. Add face recognition. That’s not a violation of privacy, but the LED not being on…how dare you!",True,negative,-0.5,The user expresses frustration/disapproval regarding the implementation (or lack thereof) of a feature related to facial recognition.
o59k28p,1r3vja0,Congrats you’re in a surveillance state.,2,2026-02-14,privacy,congrats you re in a surveillance state.,KIQ_3_2,Congrats you’re in a surveillance state.,True,negative,-0.8,"The comment implies surveillance, directly relating to the privacy concerns surrounding facial recognition features like Name Tag."
o5a2yrp,1r3vja0,"Understand that I am in no way supporting this, but is the thing about this the fact that another human is wearing them, and what they would do with that information? What if it were one of those Boston Dynamic robots wearing them, is it any different?
But again, f this idea.",1,2026-02-14,privacy,"understand that i am in no way supporting this, but is the thing about this the fact that another human is wearing them, and what they would do with that information? what if it were one of those boston dynamic robots wearing them, is it any different? but again, f this idea.",KIQ_3_2,"Understand that I am in no way supporting this, but is the thing about this the fact that another human is wearing them, and what they would do with that information? What if it were one of those Boston Dynamic robots wearing them, is it any different?
But again, f this idea.",True,negative,-0.7,The comment directly questions the implications and privacy concerns of facial recognition technology on the glasses.
o5bjjo0,1r3vja0,"Predatory reasons most likely. 

The only other reason, which has a worthy real world use is for people without eyes and the camera somehow connects to the brain waves, or for deaf people who can then read what is said as subtitles at the bottom of the glaasses vision.",0,2026-02-14,privacy,"predatory reasons most likely. the only other reason, which has a worthy real world use is for people without eyes and the camera somehow connects to the brain waves, or for deaf people who can then read what is said as subtitles at the bottom of the glaasses vision.",KIQ_3_2,"Predatory reasons most likely. 

The only other reason, which has a worthy real world use is for people without eyes and the camera somehow connects to the brain waves, or for deaf people who can then read what is said as subtitles at the bottom of the glaasses vision.",True,negative,-0.5,"The comment suggests 'predatory reasons' for the feature, indicating skepticism toward its purpose."
o5chje9,1r3vja0,So do they not understand that the end result of that is that might piss off pwople enough that they crush the glasses and try to feed them the bullshit things?,2,2026-02-14,privacy,so do they not understand that the end result of that is that might piss off pwople enough that they crush the glasses and try to feed them the bullshit things?,KIQ_3_2,So do they not understand that the end result of that is that might piss off pwople enough that they crush the glasses and try to feed them the bullshit things?,True,negative,-0.7,The comment expresses concern that facial recognition features will cause user backlash and product rejection.
o9850ja,1rnoiow,"Beep. Boop. I'm a bot.

It seems the URL that you shared contains trackers.

Try this cleaned URL instead: https://appleinsider.com/articles/26/03/03/what-privacy-as-expected-meta-ray-bans-are-a-privacy-disaster

If you'd like me to clean URLs before you post them, you can send me a private message with the URL and I'll reply with a cleaned URL.",30,2026-03-07,privacy,"beep. boop. i'm a bot. it seems the url that you shared contains trackers. try this cleaned url instead if you'd like me to clean urls before you post them, you can send me a private message with the url and i'll reply with a cleaned url.",KIQ_3_2,"Beep. Boop. I'm a bot.

It seems the URL that you shared contains trackers.

Try this cleaned URL instead: https://appleinsider.com/articles/26/03/03/what-privacy-as-expected-meta-ray-bans-are-a-privacy-disaster

If you'd like me to clean URLs before you post them, you can send me a private message with the URL and I'll reply with a cleaned URL.",True,negative,-0.5,"The comment links to an article titled 'Meta Ray-Bans are a privacy disaster,' directly addressing privacy concerns related to Meta's glasses."
