comment_id,post_id,body,score,created_utc,subreddit,body_clean,kiq_label,_llm_text,is_relevant,sentiment_label,sentiment_score,reason
o8n1kqb,1rknu5q,"First, it's refreshing to read a well thought and balanced post on Reddit.

Second, I truly believe that we can have our cake and eat it too.

""Build the guardrails. Do not kill the technology."" This is the balanced approach.

All of that being said, we know that meta will do anything for shareholder value, no matter what damage it causes to society. Thus, as a society we have the right to oppose anything that will cause harm while enabling things that are beneficial to a better quality of life.

Do we really need another device that will be used to invade our privacy and disturb the rare tranquil moments in our life? No. But this should not be the reason to deprive individuals from the availability of tech that will improve their lives. My initial thought is that the mass consumer version of any smart glasses should have no capabilities to use facial recognition and the cameras covered until they are in use, while disabled or impaired consumers should have facial recognition as an option and the cameras covered until they are in use; explicit external cues to camera use are a must. Same hardware with baked in software guardrails.

My controversial take is that no business or citizen should be obliged to allow smart glasses on their property, except for disabled or impaired individuals in a similar way that access is permitted to service animals or ramps for wheel chair access is required.

Why the divide? Look at the current administration, that's it. We thought it was never going to get this bad but here we are. If they have another surface of attack they will use it against us.



",3,2026-03-04,augmentedreality,"first, it's refreshing to read a well thought and balanced post on reddit. second, i truly believe that we can have our cake and eat it too. build the guardrails. do not kill the technology. this is the balanced approach. all of that being said, we know that meta will do anything for shareholder value, no matter what damage it causes to society. thus, as a society we have the right to oppose anything that will cause harm while enabling things that are beneficial to a better quality of life. do we really need another device that will be used to invade our privacy and disturb the rare tranquil moments in our life? no. but this should not be the reason to deprive individuals from the availability of tech that will improve their lives. my initial thought is that the mass consumer version of any smart glasses should have no capabilities to use facial recognition and the cameras covered until they are in use, while disabled or impaired consumers should have facial recognition as an option and the cameras covered until they are in use explicit external cues to camera use are a must. same hardware with baked in software guardrails. my controversial take is that no business or citizen should be obliged to allow smart glasses on their property, except for disabled or impaired individuals in a similar way that access is permitted to service animals or ramps for wheel chair access is required. why the divide? look at the current administration, that's it. we thought it was never going to get this bad but here we are. if they have another surface of attack they will use it against us.",KIQ_3_2,"First, it's refreshing to read a well thought and balanced post on Reddit.

Second, I truly believe that we can have our cake and eat it too.

""Build the guardrails. Do not kill the technology."" This is the balanced approach.

All of that being said, we know that meta will do anything for shareholder value, no matter what damage it causes to society. Thus, as a society we have the right to oppose anything that will cause harm while enabling things that are beneficial to a better quality of life.

Do we really need another device that will be used to invade our privacy and disturb the rare tranquil moments in our life? No. But this should not be the reason to deprive individuals from the availability of tech that will improve their lives. My initial thought is that the mass consumer version of any smart glasses should have no capabilities to use facial recognition and the cameras covered until they are in use, while disabled or impaired consumers should have facial recognition as an option and the cameras covered until they are in use; explicit external cues to camera use are a must. Same hardware with baked in software guardrails.

My controversial take is that no business or citizen should be obliged to allow smart glasses on their property, except for disabled or impaired individuals in a similar way that access is permitted to service animals or ramps for wheel chair access is required.

Why the divide? Look at the current administration, that's it. We thought it was never going to get this bad but here we are. If they have another surface of attack they will use it against us.



",True,negative,-0.4,"Expresses strong opposition to facial recognition in consumer smart glasses, citing privacy concerns."
o8n4wgo,1rknu5q,"Agreed, people with disabilities deserve user privacy built into their features and seeing this trend of “greenwashing” of sorts for accessibility features with no user privacy built in from the ground up arguably macerating as data collection avenues to train AI models. ",1,2026-03-04,augmentedreality,"agreed, people with disabilities deserve user privacy built into their features and seeing this trend of greenwashing of sorts for accessibility features with no user privacy built in from the ground up arguably macerating as data collection avenues to train ai models.",KIQ_3_2,"Agreed, people with disabilities deserve user privacy built into their features and seeing this trend of “greenwashing” of sorts for accessibility features with no user privacy built in from the ground up arguably macerating as data collection avenues to train AI models. ",True,negative,-0.7,"Critiques the trend of accessibility features being used as data collection avenues, implying privacy concerns related to AI/facial recognition."
o8npivy,1rknu5q,"I don’t think anyone would be bothered by a father waiting outside a school. We’d only be outraged if it were a predator. And let’s be honest—Meta is a predator, a predator of our privacy. The real problem isn’t the technology itself; it’s the people building it and the power they hold over us.",8,2026-03-04,augmentedreality,"i don t think anyone would be bothered by a father waiting outside a school. we d only be outraged if it were a predator. and let s be honest meta is a predator, a predator of our privacy. the real problem isn t the technology itself it s the people building it and the power they hold over us.",KIQ_3_2,"I don’t think anyone would be bothered by a father waiting outside a school. We’d only be outraged if it were a predator. And let’s be honest—Meta is a predator, a predator of our privacy. The real problem isn’t the technology itself; it’s the people building it and the power they hold over us.",True,negative,-0.7,"It criticizes Meta's power and privacy practices, linking them to predatory behavior, which relates to facial recognition concerns."
o8nzz8l,1rknu5q,"It’s a shame for people with disability like you highlight, but I don’t think we can trust the companies making these products. They are not making the guard rails. The fact Samsung’s latest 2026 event highlighted the ability to change people clothes using AI even after the entire Grok bikini switch incident is just totally tone-deaf. My partner’s trade school is currently dealing with a peeping tom taking photos of women as they use the bathroom, and Meta’s glasses have only made this kind of incident worse. Facebook as a company was started as a way to rate women’s looks without their knowledge. I just don’t think we can have these companies deliver safe products responsibly. They have shown time and time again they cannot. 

I’m sorry if that means accessibility progress is slowed down but **it’s not worth the risk of abuse to the population.**

For your sake, I hope a small, genuine accessibility-focused company releases safe products because I for one do not want society to be shaped by these products if they are manufactured and controlled by big tech.

Meta should be ashamed by their launch strategy, exploiting disability access… but Meta has no shame.",3,2026-03-04,augmentedreality,"it s a shame for people with disability like you highlight, but i don t think we can trust the companies making these products. they are not making the guard rails. the fact samsung s latest 2026 event highlighted the ability to change people clothes using ai even after the entire grok bikini switch incident is just totally tone-deaf. my partner s trade school is currently dealing with a peeping tom taking photos of women as they use the bathroom, and meta s glasses have only made this kind of incident worse. facebook as a company was started as a way to rate women s looks without their knowledge. i just don t think we can have these companies deliver safe products responsibly. they have shown time and time again they cannot. i m sorry if that means accessibility progress is slowed down but it s not worth the risk of abuse to the population. for your sake, i hope a small, genuine accessibility-focused company releases safe products because i for one do not want society to be shaped by these products if they are manufactured and controlled by big tech. meta should be ashamed by their launch strategy, exploiting disability access but meta has no shame.",KIQ_3_2,"It’s a shame for people with disability like you highlight, but I don’t think we can trust the companies making these products. They are not making the guard rails. The fact Samsung’s latest 2026 event highlighted the ability to change people clothes using AI even after the entire Grok bikini switch incident is just totally tone-deaf. My partner’s trade school is currently dealing with a peeping tom taking photos of women as they use the bathroom, and Meta’s glasses have only made this kind of incident worse. Facebook as a company was started as a way to rate women’s looks without their knowledge. I just don’t think we can have these companies deliver safe products responsibly. They have shown time and time again they cannot. 

I’m sorry if that means accessibility progress is slowed down but **it’s not worth the risk of abuse to the population.**

For your sake, I hope a small, genuine accessibility-focused company releases safe products because I for one do not want society to be shaped by these products if they are manufactured and controlled by big tech.

Meta should be ashamed by their launch strategy, exploiting disability access… but Meta has no shame.",True,negative,-0.8,"The user expresses deep distrust in big tech, specifically mentioning Meta's products and the risk of abuse."
o8tigc6,1rknu5q,"I don’t think the backlash will amount to anything. It’s over and done. Meta’s already sold I think it’s 7M glasses, multiple orders of magnitude more than Google Glass. They’re stylish, and getting even more so, so they’re not the obvious thing that Glass was. (Which never allowed facial recognition apps - pretty much the only thing I wanted them for since I have pretty significant face blindness.)

This is basically the equivalent of people finding out that Browser Cookies can be used to track you online. People will be upset about it and that concern will largely go away.",1,2026-03-05,augmentedreality,"i don t think the backlash will amount to anything. it s over and done. meta s already sold i think it s 7m glasses, multiple orders of magnitude more than google glass. they re stylish, and getting even more so, so they re not the obvious thing that glass was. which never allowed facial recognition apps - pretty much the only thing i wanted them for since i have pretty significant face blindness. this is basically the equivalent of people finding out that browser cookies can be used to track you online. people will be upset about it and that concern will largely go away.",KIQ_3_2,"I don’t think the backlash will amount to anything. It’s over and done. Meta’s already sold I think it’s 7M glasses, multiple orders of magnitude more than Google Glass. They’re stylish, and getting even more so, so they’re not the obvious thing that Glass was. (Which never allowed facial recognition apps - pretty much the only thing I wanted them for since I have pretty significant face blindness.)

This is basically the equivalent of people finding out that Browser Cookies can be used to track you online. People will be upset about it and that concern will largely go away.",True,neutral,0.1,"Discusses the expected public reaction to Meta's features, implying acceptance of the technology."
o8vis42,1rknu5q,"PS Things need to change ASAP 

# You Bought Zuck’s Ray-Bans. Now Someone in Nairobi Is Watching You Poop.

 [https://blog.adafruit.com/2026/03/04/you-bought-zucks-ray-bans-now-someone-in-nairobi-is-watching-you-poop/](https://blog.adafruit.com/2026/03/04/you-bought-zucks-ray-bans-now-someone-in-nairobi-is-watching-you-poop/)",1,2026-03-05,augmentedreality,ps things need to change asap you bought zuck s ray-bans. now someone in nairobi is watching you poop.,KIQ_3_2,"PS Things need to change ASAP 

# You Bought Zuck’s Ray-Bans. Now Someone in Nairobi Is Watching You Poop.

 [https://blog.adafruit.com/2026/03/04/you-bought-zucks-ray-bans-now-someone-in-nairobi-is-watching-you-poop/](https://blog.adafruit.com/2026/03/04/you-bought-zucks-ray-bans-now-someone-in-nairobi-is-watching-you-poop/)",True,negative,-0.8,The comment uses hyperbolic language to express strong privacy concerns regarding surveillance via the glasses.
o98moiv,1rknu5q,"As someone that can no longer recognize people I know due to macular degeneration, I pretty much always walk with my head down so I don't seem like I'm ignoring them. Would be great to have a way to be notified of who I'm passing, only if they are known to me, so maybe it could be set to identify just those people. However, I would not want to be humiliated by wearing a brightly glowing set of glasses letting everyone know that I am visually disabled.  ",1,2026-03-08,augmentedreality,"as someone that can no longer recognize people i know due to macular degeneration, i pretty much always walk with my head down so i don't seem like i'm ignoring them. would be great to have a way to be notified of who i'm passing, only if they are known to me, so maybe it could be set to identify just those people. however, i would not want to be humiliated by wearing a brightly glowing set of glasses letting everyone know that i am visually disabled.",KIQ_3_2,"As someone that can no longer recognize people I know due to macular degeneration, I pretty much always walk with my head down so I don't seem like I'm ignoring them. Would be great to have a way to be notified of who I'm passing, only if they are known to me, so maybe it could be set to identify just those people. However, I would not want to be humiliated by wearing a brightly glowing set of glasses letting everyone know that I am visually disabled.  ",True,neutral,0.1,"Expresses a need for a specific, privacy-conscious facial recognition feature for accessibility."
o56fvoy,1r3s14v,"> Sources tell The Times that the facial recognition technology wouldn’t allow people to identify everyone they see. Instead, Meta is reportedly considering using the feature to detect people that the wearer is connected with on one of Meta’s platforms. It’s also exploring “identifying people whom the user may not know but who have a public account on a Meta site like Instagram,” according to The New York Times. 


Sooooo almost everyone? And anyone not using Facebook or Instagram can just get an account made without their permission and be added the panopticon without their consent.",181,2026-02-13,technology,"sources tell the times that the facial recognition technology wouldn t allow people to identify everyone they see. instead, meta is reportedly considering using the feature to detect people that the wearer is connected with on one of meta s platforms. it s also exploring identifying people whom the user may not know but who have a public account on a meta site like instagram, according to the new york times. sooooo almost everyone? and anyone not using facebook or instagram can just get an account made without their permission and be added the panopticon without their consent.",KIQ_3_2,"> Sources tell The Times that the facial recognition technology wouldn’t allow people to identify everyone they see. Instead, Meta is reportedly considering using the feature to detect people that the wearer is connected with on one of Meta’s platforms. It’s also exploring “identifying people whom the user may not know but who have a public account on a Meta site like Instagram,” according to The New York Times. 


Sooooo almost everyone? And anyone not using Facebook or Instagram can just get an account made without their permission and be added the panopticon without their consent.",True,negative,-0.8,The comment expresses strong concern and distrust regarding Meta's facial recognition scope and privacy implications.
o56h5gu,1r3s14v,"Either way, Meta is still identifying everyone the person sees.",86,2026-02-13,technology,"either way, meta is still identifying everyone the person sees.",KIQ_3_2,"Either way, Meta is still identifying everyone the person sees.",True,negative,-0.5,The comment implies surveillance or unwanted identification by Meta's technology.
o56hrrt,1r3s14v, Face recognition nice for identifying government employees that wear face masks,16,2026-02-13,technology,face recognition nice for identifying government employees that wear face masks,KIQ_3_2, Face recognition nice for identifying government employees that wear face masks,True,positive,0.5,"The comment explicitly supports the use of facial recognition for identification, aligning with the topic."
o56jxri,1r3s14v,I cannot believe any bullshit reason they need to make this. If humans wanted every stranger to know their personal details they’d wear ID badges in public.,67,2026-02-13,technology,i cannot believe any bullshit reason they need to make this. if humans wanted every stranger to know their personal details they d wear id badges in public.,KIQ_3_2,I cannot believe any bullshit reason they need to make this. If humans wanted every stranger to know their personal details they’d wear ID badges in public.,True,negative,-0.7,"The comment expresses strong disapproval regarding the necessity of the feature, implying opposition to the facial recognition aspect."
o56or7e,1r3s14v,"From the NYTimes reporting this Verge piece is built from:

\> “We will launch during a dynamic political environment where many civil society groups that we would expect to attack us would have their resources focused on other concerns,” according to the document from Meta’s Reality Labs.

So… not cool.

[https://www.nytimes.com/2026/02/13/technology/meta-facial-recognition-smart-glasses.html?unlocked\_article\_code=1.L1A.xDlk.6WAHejN0ZBog&smid=url-share](https://www.nytimes.com/2026/02/13/technology/meta-facial-recognition-smart-glasses.html?unlocked_article_code=1.L1A.xDlk.6WAHejN0ZBog&smid=url-share)",33,2026-02-13,technology,"from the nytimes reporting this verge piece is built from we will launch during a dynamic political environment where many civil society groups that we would expect to attack us would have their resources focused on other concerns, according to the document from meta s reality labs. so not cool.",KIQ_3_2,"From the NYTimes reporting this Verge piece is built from:

\> “We will launch during a dynamic political environment where many civil society groups that we would expect to attack us would have their resources focused on other concerns,” according to the document from Meta’s Reality Labs.

So… not cool.

[https://www.nytimes.com/2026/02/13/technology/meta-facial-recognition-smart-glasses.html?unlocked\_article\_code=1.L1A.xDlk.6WAHejN0ZBog&smid=url-share](https://www.nytimes.com/2026/02/13/technology/meta-facial-recognition-smart-glasses.html?unlocked_article_code=1.L1A.xDlk.6WAHejN0ZBog&smid=url-share)",True,negative,-0.7,"The comment cites reporting on Meta's facial recognition plans, expressing disapproval of the timing."
o56pgek,1r3s14v,"Is this in real life or will this work with images on a screen?  

For instance if you watch a porn image will it find their real name and a link to their Facebook/Instagram page?",1,2026-02-13,technology,is this in real life or will this work with images on a screen? for instance if you watch a porn image will it find their real name and a link to their facebook instagram page?,KIQ_3_2,"Is this in real life or will this work with images on a screen?  

For instance if you watch a porn image will it find their real name and a link to their Facebook/Instagram page?",True,neutral,0.1,"It questions the functionality of facial recognition (Name Tag) in a specific, albeit extreme, use case."
o56qguc,1r3s14v,I may be old and out of the loop... Are people actually buying and wearing these?  I know the issue being talked about is facial recognition and that is a major problem but.... Aren't these like not common or popular?,3,2026-02-13,technology,i may be old and out of the loop... are people actually buying and wearing these? i know the issue being talked about is facial recognition and that is a major problem but.... aren't these like not common or popular?,KIQ_3_2,I may be old and out of the loop... Are people actually buying and wearing these?  I know the issue being talked about is facial recognition and that is a major problem but.... Aren't these like not common or popular?,True,neutral,0.1,"It mentions facial recognition as a known issue but questions general adoption, keeping it relevant to the topic."
o56uyup,1r3s14v,So now everyone will be the gargoyles from Snow Crash. ,3,2026-02-13,technology,so now everyone will be the gargoyles from snow crash.,KIQ_3_2,So now everyone will be the gargoyles from Snow Crash. ,True,negative,-0.7,The comment uses a dystopian reference ('Snow Crash') to express strong negative sentiment about the implications of facial recognition.
o56vnoo,1r3s14v,"I was at the Ray Ban store, and saw these on display. They are indistinguishable from regular glasses, at a distance. 

The salesperson in the store who was helping people was wearing a pair of these. So now I have data of myself out there somewhere. ",4,2026-02-13,technology,"i was at the ray ban store, and saw these on display. they are indistinguishable from regular glasses, at a distance. the salesperson in the store who was helping people was wearing a pair of these. so now i have data of myself out there somewhere.",KIQ_3_2,"I was at the Ray Ban store, and saw these on display. They are indistinguishable from regular glasses, at a distance. 

The salesperson in the store who was helping people was wearing a pair of these. So now I have data of myself out there somewhere. ",True,negative,-0.5,The user expresses concern about being tracked/identified by the glasses' technology.
o56w8nq,1r3s14v,Anyone who buys and wears these should be socially ostracized. It’s creepy,38,2026-02-13,technology,anyone who buys and wears these should be socially ostracized. it s creepy,KIQ_3_2,Anyone who buys and wears these should be socially ostracized. It’s creepy,True,negative,-0.8,"The comment expresses strong negative sentiment regarding the social implications of wearing the glasses, implying discomfort with the technology."
o56xksw,1r3s14v,"I saw a future-tech mock-up demo of exactly this more than ten years ago. The glasses they were dreaming of would then provide AR display of the social media you know the person from. It’s still nowhere near ready. 
Also, the privacy concerns are too late to matter when someone can just record video and fun frames through software later.  Trying to prevent it running in real time doesn’t accomplish much.",1,2026-02-13,technology,"i saw a future-tech mock-up demo of exactly this more than ten years ago. the glasses they were dreaming of would then provide ar display of the social media you know the person from. it s still nowhere near ready. also, the privacy concerns are too late to matter when someone can just record video and fun frames through software later. trying to prevent it running in real time doesn t accomplish much.",KIQ_3_2,"I saw a future-tech mock-up demo of exactly this more than ten years ago. The glasses they were dreaming of would then provide AR display of the social media you know the person from. It’s still nowhere near ready. 
Also, the privacy concerns are too late to matter when someone can just record video and fun frames through software later.  Trying to prevent it running in real time doesn’t accomplish much.",True,negative,-0.6,Expresses skepticism about the technology's readiness and raises significant privacy concerns regarding real-time facial recognition.
