comment_id,post_id,body,score,created_utc,subreddit,body_clean,kiq_label,_llm_text,is_relevant,sentiment_label,sentiment_score,reason
o571ry6,1r3s14v,I will legitimately stop talking to anyone who have any kind of camera glasses. It would make me think the person is creepy and does not value privacy.,21,2026-02-13,technology,i will legitimately stop talking to anyone who have any kind of camera glasses. it would make me think the person is creepy and does not value privacy.,KIQ_3_2,I will legitimately stop talking to anyone who have any kind of camera glasses. It would make me think the person is creepy and does not value privacy.,True,negative,-0.8,"Expresses strong negative sentiment against camera glasses, which directly relates to the privacy concerns surrounding facial recognition features."
o575iv1,1r3s14v,"And remember, you're not the only one who sees what you see through smart glasses. All of Meta's data customers watch with you.",2,2026-02-13,technology,"and remember, you're not the only one who sees what you see through smart glasses. all of meta's data customers watch with you.",KIQ_3_2,"And remember, you're not the only one who sees what you see through smart glasses. All of Meta's data customers watch with you.",True,negative,-0.7,"Implies surveillance and data collection by Meta, which is a core concern regarding facial recognition features."
o57dhxj,1r3s14v," >And anyone not using Facebook or Instagram can just get an account made without their permission and be added the panopticon without their consent.

Not in the EU or California they can’t, at least not legally.",1,2026-02-13,technology,"and anyone not using facebook or instagram can just get an account made without their permission and be added the panopticon without their consent. not in the eu or california they can t, at least not legally.",KIQ_3_2," >And anyone not using Facebook or Instagram can just get an account made without their permission and be added the panopticon without their consent.

Not in the EU or California they can’t, at least not legally.",True,negative,-0.7,Expresses concern about unauthorized surveillance and lack of consent regarding facial recognition.
o57dl8f,1r3s14v,"This is cool and all until they decide to share all this info with ICE. 

It's weird that me typing that is not some wild conspiracy theory either",2,2026-02-13,technology,this is cool and all until they decide to share all this info with ice. it's weird that me typing that is not some wild conspiracy theory either,KIQ_3_2,"This is cool and all until they decide to share all this info with ICE. 

It's weird that me typing that is not some wild conspiracy theory either",True,negative,-0.7,Expresses concern about privacy and misuse of facial recognition data by authorities (ICE).
o57fukl,1r3s14v,so perfect for creepshots then?  sounds like a huge safety concern,4,2026-02-13,technology,so perfect for creepshots then? sounds like a huge safety concern,KIQ_3_2,so perfect for creepshots then?  sounds like a huge safety concern,True,negative,-0.8,The comment expresses concern about the privacy and safety implications of facial recognition features.
o57uwn0,1r3s14v,"This would be pretty helpful for me, since I can't visualize or remember faces well at all. I can't even picture my own face.",0,2026-02-13,technology,"this would be pretty helpful for me, since i can't visualize or remember faces well at all. i can't even picture my own face.",KIQ_3_2,"This would be pretty helpful for me, since I can't visualize or remember faces well at all. I can't even picture my own face.",True,positive,0.6,The user expresses a need that a facial recognition feature like Name Tag could fulfill for them.
o58m7ct,1r3s14v,So creepy.  Enough to make a person stay home more.,3,2026-02-13,technology,so creepy. enough to make a person stay home more.,KIQ_3_2,So creepy.  Enough to make a person stay home more.,True,negative,-0.8,The comment expresses discomfort ('creepy') which strongly implies negative sentiment toward a surveillance/recognition feature.
o58om82,1r3s14v,This will certainly be used for stalking and harming people.,4,2026-02-13,technology,this will certainly be used for stalking and harming people.,KIQ_3_2,This will certainly be used for stalking and harming people.,True,negative,-0.8,The comment expresses fear that the feature will be used for stalking and harming people.
o58pm7i,1r3s14v,Same.  I have aphantasia and it leads me to a very hard time connecting faces to names.  I have always wanted a heads up display of peoples names.  Maybe with a note I've left myself about them:  John Doe - close talker,1,2026-02-13,technology,same. i have aphantasia and it leads me to a very hard time connecting faces to names. i have always wanted a heads up display of peoples names. maybe with a note i've left myself about them john doe - close talker,KIQ_3_2,Same.  I have aphantasia and it leads me to a very hard time connecting faces to names.  I have always wanted a heads up display of peoples names.  Maybe with a note I've left myself about them:  John Doe - close talker,True,positive,0.6,"The user expresses a desire for a heads-up display of names, directly aligning with the function of Name Tag."
o58z6ji,1r3s14v,can we please fucking STOP with the surveillance state bullshit??,7,2026-02-13,technology,can we please fucking stop with the surveillance state bullshit??,KIQ_3_2,can we please fucking STOP with the surveillance state bullshit??,True,negative,-0.8,"The comment expresses strong opposition to surveillance, which directly relates to the privacy concerns surrounding facial recognition features."
o590804,1r3s14v,Great fucking Ring tracking you everywhere and now this bullshit. If I see anyone I know wearing these things I'm punching them in the face.,1,2026-02-13,technology,great fucking ring tracking you everywhere and now this bullshit. if i see anyone i know wearing these things i'm punching them in the face.,KIQ_3_2,Great fucking Ring tracking you everywhere and now this bullshit. If I see anyone I know wearing these things I'm punching them in the face.,True,negative,-0.9,"The comment expresses extreme hostility toward tracking/recognition technology, directly referencing the invasive nature of such features."
o593ifi,1r3s14v,Every creep and stalker on earth will want these.  Does Zuckerberg not see that?  Or does he just not care?,2,2026-02-13,technology,every creep and stalker on earth will want these. does zuckerberg not see that? or does he just not care?,KIQ_3_2,Every creep and stalker on earth will want these.  Does Zuckerberg not see that?  Or does he just not care?,True,negative,-0.8,The comment expresses strong negative concern about the potential misuse of facial recognition technology.
o5961qg,1r3s14v,"Does the world need Creep Glasses?

They don't serve any real purpose.",1,2026-02-13,technology,does the world need creep glasses? they don't serve any real purpose.,KIQ_3_2,"Does the world need Creep Glasses?

They don't serve any real purpose.",True,negative,-0.7,"The comment directly questions the utility of 'Creep Glasses,' implying disapproval of the feature."
o597378,1r3s14v,I guess the ones of us that see where this East German style Stasi shit and don’t trust Fuckerberg and every other company that starts down this road or shares all that data we have to start wearing masks and in public ?,3,2026-02-13,technology,i guess the ones of us that see where this east german style stasi shit and don t trust fuckerberg and every other company that starts down this road or shares all that data we have to start wearing masks and in public ?,KIQ_3_2,I guess the ones of us that see where this East German style Stasi shit and don’t trust Fuckerberg and every other company that starts down this road or shares all that data we have to start wearing masks and in public ?,True,negative,-0.8,"The comment expresses strong distrust regarding facial recognition technology, referencing surveillance concerns related to Meta's features."
o59eo7k,1r3s14v,People who buy glasses with cameras in them are your enemies. You simply can’t get this kind of information gather tech from corps who obviously don’t care if you live or die.,3,2026-02-14,technology,people who buy glasses with cameras in them are your enemies. you simply can t get this kind of information gather tech from corps who obviously don t care if you live or die.,KIQ_3_2,People who buy glasses with cameras in them are your enemies. You simply can’t get this kind of information gather tech from corps who obviously don’t care if you live or die.,True,negative,-0.8,Expresses strong distrust and opposition to the surveillance aspect of camera-equipped glasses.
o59ho67,1r3s14v,Flock...but for yer FaCe,1,2026-02-14,technology,flock...but for yer face,KIQ_3_2,Flock...but for yer FaCe,True,neutral,0.0,"The phrase is cryptic but directly references 'Face,' suggesting a connection to facial recognition features."
o59rv13,1r3s14v,All three paid influencers who wear them will become walking spybots!,2,2026-02-14,technology,all three paid influencers who wear them will become walking spybots!,KIQ_3_2,All three paid influencers who wear them will become walking spybots!,True,negative,-0.7,"The comment implies surveillance and distrust regarding the glasses' capabilities, linking them to 'spybots'."
o5a5us2,1r3s14v,"NGL this is almost my dream tech. I remember '60s song lyrics much better than I remember people's names, much less why we talked about last time we met. Glasses that recognize a face, scroll their name, how we know each other, what we talked about last time, names of life partners and kids, even suggested questions to ask? Privacy shmivacy. (I'm partly kidding. But only partly.)",-2,2026-02-14,technology,"ngl this is almost my dream tech. i remember '60s song lyrics much better than i remember people's names, much less why we talked about last time we met. glasses that recognize a face, scroll their name, how we know each other, what we talked about last time, names of life partners and kids, even suggested questions to ask? privacy shmivacy. i'm partly kidding. but only partly.",KIQ_3_2,"NGL this is almost my dream tech. I remember '60s song lyrics much better than I remember people's names, much less why we talked about last time we met. Glasses that recognize a face, scroll their name, how we know each other, what we talked about last time, names of life partners and kids, even suggested questions to ask? Privacy shmivacy. (I'm partly kidding. But only partly.)",True,positive,0.8,The user expresses excitement about the concept of face recognition and name tagging features.
o5anznk,1r3s14v,They’ve already been convictions from people using them inappropriately.,1,2026-02-14,technology,they ve already been convictions from people using them inappropriately.,KIQ_3_2,They’ve already been convictions from people using them inappropriately.,True,negative,-0.5,"Mentions inappropriate use, implying negative consequences related to the technology's function."
o5aoaw2,1r3s14v,"Me either, is clearly a group using them, the issue is whether or not it’s rapidly increasing or not. If it starts taking off, I expect to see much stronger pushback legislatively, in some countries at least.",1,2026-02-14,technology,"me either, is clearly a group using them, the issue is whether or not it s rapidly increasing or not. if it starts taking off, i expect to see much stronger pushback legislatively, in some countries at least.",KIQ_3_2,"Me either, is clearly a group using them, the issue is whether or not it’s rapidly increasing or not. If it starts taking off, I expect to see much stronger pushback legislatively, in some countries at least.",True,neutral,0.1,"Discusses potential legislative pushback regarding the adoption of the technology, which relates to facial recognition."
o5azsd7,1r3s14v,More like Meta will have a backdoor to access data from your glasses to sell to federal agents and disappear people you saw that day,2,2026-02-14,technology,more like meta will have a backdoor to access data from your glasses to sell to federal agents and disappear people you saw that day,KIQ_3_2,More like Meta will have a backdoor to access data from your glasses to sell to federal agents and disappear people you saw that day,True,negative,-0.9,Expresses strong distrust and fear regarding Meta's data access and surveillance capabilities via the glasses.
o5b9o39,1r3s14v,"the ""not everyone"" framing is so dishonest. Meta has shadow profiles on people who have never made an account. they scrape contact lists, photos friends upload, location data from apps that use their SDK. so even if you've never touched facebook in your life, they probably have enough on you to build a face profile.

""we won't identify everyone you see"" just means ""we won't show you the results for everyone you see."" the identification is still happening on their end. the data still gets collected and stored. they're just choosing what to surface to the user vs what they keep for themselves and their ad partners.",8,2026-02-14,technology,"the not everyone framing is so dishonest. meta has shadow profiles on people who have never made an account. they scrape contact lists, photos friends upload, location data from apps that use their sdk. so even if you've never touched facebook in your life, they probably have enough on you to build a face profile. we won't identify everyone you see just means we won't show you the results for everyone you see. the identification is still happening on their end. the data still gets collected and stored. they're just choosing what to surface to the user vs what they keep for themselves and their ad partners.",KIQ_3_2,"the ""not everyone"" framing is so dishonest. Meta has shadow profiles on people who have never made an account. they scrape contact lists, photos friends upload, location data from apps that use their SDK. so even if you've never touched facebook in your life, they probably have enough on you to build a face profile.

""we won't identify everyone you see"" just means ""we won't show you the results for everyone you see."" the identification is still happening on their end. the data still gets collected and stored. they're just choosing what to surface to the user vs what they keep for themselves and their ad partners.",True,negative,-0.8,"Critiques Meta's privacy practices regarding data collection and identification capabilities, directly related to facial recognition."
o5b9oiv,1r3s14v,"that quote is genuinely insane. they literally put in writing ""lets do it now while the people who would stop us are busy fighting other fires."" thats not a tech company, thats how someone plans a heist.

and the thing is it works. everyone's dealing with so much right now that a facial recognition rollout on consumer glasses barely makes a ripple. two years ago this would've been front page news for weeks. now its just another tuesday. they know exactly what they're doing and they wrote it down because they're that confident nobody can stop them.",5,2026-02-14,technology,"that quote is genuinely insane. they literally put in writing lets do it now while the people who would stop us are busy fighting other fires. thats not a tech company, thats how someone plans a heist. and the thing is it works. everyone's dealing with so much right now that a facial recognition rollout on consumer glasses barely makes a ripple. two years ago this would've been front page news for weeks. now its just another tuesday. they know exactly what they're doing and they wrote it down because they're that confident nobody can stop them.",KIQ_3_2,"that quote is genuinely insane. they literally put in writing ""lets do it now while the people who would stop us are busy fighting other fires."" thats not a tech company, thats how someone plans a heist.

and the thing is it works. everyone's dealing with so much right now that a facial recognition rollout on consumer glasses barely makes a ripple. two years ago this would've been front page news for weeks. now its just another tuesday. they know exactly what they're doing and they wrote it down because they're that confident nobody can stop them.",True,negative,-0.7,"The comment discusses the confidence and perceived lack of resistance to a feature rollout, implying negative views on the facial recognition aspect."
o5b9oyf,1r3s14v,"this is the part that freaks me out the most tbh. google glass failed partly because they looked ridiculous and everyone could tell you were wearing a camera on your face. these things look like normal ray bans. you can't tell someone is recording you or scanning your face.

at least with a phone you can see someone pointing it at you. with these its completely invisible. the salesperson was wearing them and you had no idea until you were already being recorded. thats not a feature, thats a surveillance tool disguised as fashion. there needs to be some kind of visible indicator that a camera is active, by law, not just a tiny LED that nobody notices.",1,2026-02-14,technology,"this is the part that freaks me out the most tbh. google glass failed partly because they looked ridiculous and everyone could tell you were wearing a camera on your face. these things look like normal ray bans. you can't tell someone is recording you or scanning your face. at least with a phone you can see someone pointing it at you. with these its completely invisible. the salesperson was wearing them and you had no idea until you were already being recorded. thats not a feature, thats a surveillance tool disguised as fashion. there needs to be some kind of visible indicator that a camera is active, by law, not just a tiny led that nobody notices.",KIQ_3_2,"this is the part that freaks me out the most tbh. google glass failed partly because they looked ridiculous and everyone could tell you were wearing a camera on your face. these things look like normal ray bans. you can't tell someone is recording you or scanning your face.

at least with a phone you can see someone pointing it at you. with these its completely invisible. the salesperson was wearing them and you had no idea until you were already being recorded. thats not a feature, thats a surveillance tool disguised as fashion. there needs to be some kind of visible indicator that a camera is active, by law, not just a tiny LED that nobody notices.",True,negative,-0.8,"Expresses strong concern over the invisible nature of recording/scanning, framing it as surveillance."
o5bt67f,1r3s14v,"No, it's terrifying",1,2026-02-14,technology,"no, it's terrifying",KIQ_3_2,"No, it's terrifying",True,negative,-0.8,"The comment expresses fear ('terrifying'), directly relating to the privacy concerns surrounding facial recognition features like Name Tag."
o5chxka,1r3s14v,I would like glasses that recognize people and tell me their name because I always forget.,2,2026-02-14,technology,i would like glasses that recognize people and tell me their name because i always forget.,KIQ_3_2,I would like glasses that recognize people and tell me their name because I always forget.,True,positive,0.7,The user explicitly desires a feature (name recognition) that aligns directly with Meta's Name Tag functionality.
o5g4ge8,1r3s14v,PedoSpecs by Meta,1,2026-02-15,technology,pedospecs by meta,KIQ_3_2,PedoSpecs by Meta,True,negative,-0.8,"The term 'PedoSpecs' is a highly derogatory and negative reference to Meta's smart glasses, implying misuse of facial recognition."
o5qiki3,1r3s14v,"As a long time Ray-Ban enjoyer, these things have ruined them. Now I’m worried folks will think I’m wearing these creeper cams. Yuck. ",1,2026-02-16,technology,"as a long time ray-ban enjoyer, these things have ruined them. now i m worried folks will think i m wearing these creeper cams. yuck.",KIQ_3_2,"As a long time Ray-Ban enjoyer, these things have ruined them. Now I’m worried folks will think I’m wearing these creeper cams. Yuck. ",True,negative,-0.7,The user expresses discomfort and fear of being perceived as a 'creeper' due to the glasses' surveillance capabilities.
og0mbvi,1r3s14v,"If I wanted to, it would be really easy to make a fake account using someone's photo - the TV series Catfish has taught me that 😂.

But in all seriousness, you make an account with any name, then add some photos of the person you want to stalk, become friends with them and then suddenly you have a camera on your face that can help you find them in a crowd......  That's weird  andwrong stuff right there.",1,2026-04-13,technology,"if i wanted to, it would be really easy to make a fake account using someone's photo - the tv series catfish has taught me that . but in all seriousness, you make an account with any name, then add some photos of the person you want to stalk, become friends with them and then suddenly you have a camera on your face that can help you find them in a crowd...... that's weird andwrong stuff right there.",KIQ_3_2,"If I wanted to, it would be really easy to make a fake account using someone's photo - the TV series Catfish has taught me that 😂.

But in all seriousness, you make an account with any name, then add some photos of the person you want to stalk, become friends with them and then suddenly you have a camera on your face that can help you find them in a crowd......  That's weird  andwrong stuff right there.",True,negative,-0.7,Expresses strong concern and distrust regarding the potential misuse and surveillance aspects of facial recognition.
oi8tr3c,1r3s14v,So these are life changing for visually impaired people but you can only consider any person wearing them must be a creep or doesn’t value privacy?,1,2026-04-25,technology,so these are life changing for visually impaired people but you can only consider any person wearing them must be a creep or doesn t value privacy?,KIQ_3_2,So these are life changing for visually impaired people but you can only consider any person wearing them must be a creep or doesn’t value privacy?,True,negative,-0.6,The comment expresses strong negative sentiment regarding the privacy implications of facial recognition.
o8shds1,1rljafg,They should be conspicuously labeled.,1,2026-03-05,technology,they should be conspicuously labeled.,KIQ_3_2,They should be conspicuously labeled.,True,negative,-0.5,The demand for conspicuous labeling implies concern or distrust regarding the feature's privacy implications.
o8skh7g,1rljafg,Who would buy “smart glasses” from Meta and expect anything around them to be private?,1,2026-03-05,technology,who would buy smart glasses from meta and expect anything around them to be private?,KIQ_3_2,Who would buy “smart glasses” from Meta and expect anything around them to be private?,True,negative,-0.7,"It questions the privacy implications of Meta's smart glasses, which relates to facial recognition features."
o8smsv6,1rljafg,"A real danger to privacy, since anyone can record you at any time and even use that information for illegal activities, blackmail, scams, etc. ",6,2026-03-05,technology,"a real danger to privacy, since anyone can record you at any time and even use that information for illegal activities, blackmail, scams, etc.",KIQ_3_2,"A real danger to privacy, since anyone can record you at any time and even use that information for illegal activities, blackmail, scams, etc. ",True,negative,-0.8,The comment expresses strong concern about privacy risks associated with recording and identification features.
o8spvkt,1rljafg,Some guy was arguing lately that it's totally safe since it has recording diode indicator 😂,1,2026-03-05,technology,some guy was arguing lately that it's totally safe since it has recording diode indicator,KIQ_3_2,Some guy was arguing lately that it's totally safe since it has recording diode indicator 😂,True,neutral,0.1,"It references a safety argument regarding a recording indicator, which relates to privacy concerns around facial recognition."
o8ss2dk,1rljafg,"None of it should be reviewed by META at all, thats huge violation. I wouldn't be surprised if a lawsuit changes this.",14,2026-03-05,technology,"none of it should be reviewed by meta at all, thats huge violation. i wouldn't be surprised if a lawsuit changes this.",KIQ_3_2,"None of it should be reviewed by META at all, thats huge violation. I wouldn't be surprised if a lawsuit changes this.",True,negative,-0.7,"The comment expresses strong disapproval regarding data review/privacy, which relates to facial recognition features."
o8tiqon,1rljafg,"I hate Meta, but if you paid money to attach a camera to your face, I don't know what it is that you expected. It also is a violation of privacy for other people around them, who do not consent to be recorded. ",7,2026-03-05,technology,"i hate meta, but if you paid money to attach a camera to your face, i don't know what it is that you expected. it also is a violation of privacy for other people around them, who do not consent to be recorded.",KIQ_3_2,"I hate Meta, but if you paid money to attach a camera to your face, I don't know what it is that you expected. It also is a violation of privacy for other people around them, who do not consent to be recorded. ",True,negative,-0.8,"The comment directly criticizes the concept of attaching a camera/facial recognition to the face, citing privacy violations."
o8tmqq2,1rljafg,Why would you record stuff like that with them anyhow?? ,1,2026-03-05,technology,why would you record stuff like that with them anyhow??,KIQ_3_2,Why would you record stuff like that with them anyhow?? ,True,negative,-0.7,"The question implies concern or distrust regarding the recording capabilities, likely referencing facial recognition features."
