comment_id,post_id,body,score,created_utc,subreddit,body_clean,kiq_label,_llm_text,is_relevant,sentiment_label,sentiment_score,reason
og4l396,1sl86um,"Being able to take pictures, record and scan people's faces without them knowing is going to become increasingly easy until it is going to be impossible to stop. Today it is smart glasses, in 5-10 years, it is going to be BCI chips.


We need to stop focusing on the tech itself and start focusing on the companies. We need better privacy _laws_ and regulations about how companies process this data. Because you are never going to stop an individual from recording something for personal use. We just need to stop them from uploading it somewhere and that place accepting it.",20,2026-04-14,privacy,"being able to take pictures, record and scan people's faces without them knowing is going to become increasingly easy until it is going to be impossible to stop. today it is smart glasses, in 5-10 years, it is going to be bci chips. we need to stop focusing on the tech itself and start focusing on the companies. we need better privacy laws and regulations about how companies process this data. because you are never going to stop an individual from recording something for personal use. we just need to stop them from uploading it somewhere and that place accepting it.",KIQ_3_2,"Being able to take pictures, record and scan people's faces without them knowing is going to become increasingly easy until it is going to be impossible to stop. Today it is smart glasses, in 5-10 years, it is going to be BCI chips.


We need to stop focusing on the tech itself and start focusing on the companies. We need better privacy _laws_ and regulations about how companies process this data. Because you are never going to stop an individual from recording something for personal use. We just need to stop them from uploading it somewhere and that place accepting it.",True,negative,-0.7,Expresses strong concern over the increasing ease of facial recognition and the need for regulation.
og4oi0z,1sl86um,"Aside from it being creepy af that a stranger could walk up to you and address you by your name, it would really facilitate deception and fraud. Meta is so garbage. I guess I will be wearing my IR-blocking glasses in future.",1,2026-04-14,privacy,"aside from it being creepy af that a stranger could walk up to you and address you by your name, it would really facilitate deception and fraud. meta is so garbage. i guess i will be wearing my ir-blocking glasses in future.",KIQ_3_2,"Aside from it being creepy af that a stranger could walk up to you and address you by your name, it would really facilitate deception and fraud. Meta is so garbage. I guess I will be wearing my IR-blocking glasses in future.",True,negative,-0.8,"The comment directly criticizes the 'Name Tag' feature, citing concerns about creepiness and fraud."
og4p2qg,1sl86um,Some states ban the use of biometrics unless there is explicit opt in by the person being scanned. ,5,2026-04-14,privacy,some states ban the use of biometrics unless there is explicit opt in by the person being scanned.,KIQ_3_2,Some states ban the use of biometrics unless there is explicit opt in by the person being scanned. ,True,negative,-0.5,"It raises a legal/privacy concern directly related to biometric scanning, which is central to Name Tag."
o8vdp15,1rlvnxw,"I wear them casually, but I haven’t been brave enough in public spaces. You can sense people unfamiliar with the tech are skeptical of it recording them. 

For my close family, it’s been a great topic of conversation.

I love them while I’m driving, at home, or doing things on my own. 

I can’t speak highly enough about them if you’re an early adopter of ai, as I love the convenience of getting answers to the questions I need without having to pull out a device. It really is elegantly integrated.

I have some ethical concerns, but with any tool,  it should be used responsibly. ",1,2026-03-05,SmartGlasses,"i wear them casually, but i haven t been brave enough in public spaces. you can sense people unfamiliar with the tech are skeptical of it recording them. for my close family, it s been a great topic of conversation. i love them while i m driving, at home, or doing things on my own. i can t speak highly enough about them if you re an early adopter of ai, as i love the convenience of getting answers to the questions i need without having to pull out a device. it really is elegantly integrated. i have some ethical concerns, but with any tool, it should be used responsibly.",KIQ_3_2,"I wear them casually, but I haven’t been brave enough in public spaces. You can sense people unfamiliar with the tech are skeptical of it recording them. 

For my close family, it’s been a great topic of conversation.

I love them while I’m driving, at home, or doing things on my own. 

I can’t speak highly enough about them if you’re an early adopter of ai, as I love the convenience of getting answers to the questions I need without having to pull out a device. It really is elegantly integrated.

I have some ethical concerns, but with any tool,  it should be used responsibly. ",True,neutral,0.1,"Mentions ethical concerns and skepticism regarding recording in public, touching on the privacy aspect of the tech."
oa7yjls,1rs42a8,"There is no expectation of privacy in the public space.   I'll just leave it at that. 

",1,2026-03-13,SmartGlasses,there is no expectation of privacy in the public space. i'll just leave it at that.,KIQ_3_2,"There is no expectation of privacy in the public space.   I'll just leave it at that. 

",True,neutral,0.0,"It touches on the broader theme of public surveillance, which relates to facial recognition technology."
oauf156,1rs42a8,"Stands up in the room and points ""HEY THIS GUY IS WEARING SMART GLASSES!"" Me with my sunglasses on indoors with a blinking light. Waves back. Hey Meta - who is this asshole?",1,2026-03-17,SmartGlasses,stands up in the room and points hey this guy is wearing smart glasses! me with my sunglasses on indoors with a blinking light. waves back. hey meta - who is this asshole?,KIQ_3_2,"Stands up in the room and points ""HEY THIS GUY IS WEARING SMART GLASSES!"" Me with my sunglasses on indoors with a blinking light. Waves back. Hey Meta - who is this asshole?",True,negative,-0.6,"The comment satirizes the intrusive nature of facial recognition, implying unwanted surveillance."
oe7o5ed,1sa4hvb,"Ok so what about this? 

https://www.svd.se/a/K8nrV4/metas-ai-smart-glasses-and-data-privacy-concerns-workers-say-we-see-everything",1,2026-04-04,SmartGlasses,ok so what about this?,KIQ_3_2,"Ok so what about this? 

https://www.svd.se/a/K8nrV4/metas-ai-smart-glasses-and-data-privacy-concerns-workers-say-we-see-everything",True,negative,-0.7,"The linked article discusses data privacy concerns related to Meta's AI smart glasses, which directly relates to facial recognition."
nimzf9k,1o1xz9q,A pointless product that identifies any wearer as a gullible moron,-1,2025-10-09,augmentedreality,a pointless product that identifies any wearer as a gullible moron,KIQ_3_2,A pointless product that identifies any wearer as a gullible moron,True,negative,-0.8,"The comment directly attacks the product's function, implying the facial recognition feature is flawed or insulting."
o5b2qvv,1r4en2l,"Why do they not just offer it as an opt in option for those who are within those circles to protect everyone else? 

This is why no one trusts Meta.",6,2026-02-14,augmentedreality,why do they not just offer it as an opt in option for those who are within those circles to protect everyone else? this is why no one trusts meta.,KIQ_3_2,"Why do they not just offer it as an opt in option for those who are within those circles to protect everyone else? 

This is why no one trusts Meta.",True,negative,-0.7,The comment directly questions the implementation of a feature (implied facial recognition/Name Tag) and expresses distrust in Meta.
o5ebul7,1r4en2l,Yea who is going to stop them? Congress? lol,2,2026-02-14,augmentedreality,yea who is going to stop them? congress? lol,KIQ_3_2,Yea who is going to stop them? Congress? lol,True,negative,-0.3,Implies a lack of regulatory control over Meta's facial recognition features.
o5egwbo,1r4en2l,Sounds like a cool feature. I like your opt in idea,1,2026-02-14,augmentedreality,sounds like a cool feature. i like your opt in idea,KIQ_3_2,Sounds like a cool feature. I like your opt in idea,True,positive,0.6,"The comment explicitly supports the 'opt in idea,' which relates directly to the privacy aspect of the Name Tag feature."
o5faq0a,1r4en2l,"Yes, distracted by the news surrounding discord and the global rollout of age verification.

Sounds like the perfect way to introduce new ""privacy killing"" features to any pair of smartglasses.",0,2026-02-14,augmentedreality,"yes, distracted by the news surrounding discord and the global rollout of age verification. sounds like the perfect way to introduce new privacy killing features to any pair of smartglasses.",KIQ_3_2,"Yes, distracted by the news surrounding discord and the global rollout of age verification.

Sounds like the perfect way to introduce new ""privacy killing"" features to any pair of smartglasses.",True,negative,-0.6,"The comment links new features to 'privacy killing,' suggesting negative sentiment toward surveillance tech like facial recognition."
o94lxfg,1rlxj74,Really useful if I'm not looking at a person that records me.,1,2026-03-07,augmentedreality,really useful if i'm not looking at a person that records me.,KIQ_3_2,Really useful if I'm not looking at a person that records me.,True,neutral,0.1,"It touches on the functionality of recording/identification, but the sentiment is conditional and mild."
o9i2gy3,1rp1mpv,"I mean, if it wasn't Ray-Ban Metas, it'd probably be bodycams, right?

The concern shouldn't be just whether they're recording, but whether Meta has any kind of partnership with DHS to use AI in identifying protestors, especially in light of that reported facial recognition feature they're working on.",28,2026-03-09,augmentedreality,"i mean, if it wasn't ray-ban metas, it'd probably be bodycams, right? the concern shouldn't be just whether they're recording, but whether meta has any kind of partnership with dhs to use ai in identifying protestors, especially in light of that reported facial recognition feature they're working on.",KIQ_3_2,"I mean, if it wasn't Ray-Ban Metas, it'd probably be bodycams, right?

The concern shouldn't be just whether they're recording, but whether Meta has any kind of partnership with DHS to use AI in identifying protestors, especially in light of that reported facial recognition feature they're working on.",True,negative,-0.7,Expresses concern about Meta's facial recognition capabilities and potential government partnerships.
o9ihvj7,1rp1mpv,Facial recognition ,5,2026-03-09,augmentedreality,facial recognition,KIQ_3_2,Facial recognition ,True,neutral,0.0,The comment is a single keyword directly referencing the core technology (facial recognition) of interest.
o9ipwn3,1rp1mpv,What are they recording? YOU!!! ,1,2026-03-09,augmentedreality,what are they recording? you!!!,KIQ_3_2,What are they recording? YOU!!! ,True,negative,-0.8,"The comment expresses strong concern about surveillance and recording, directly relating to facial recognition features."
o9jahqp,1rp1mpv,"They are recording you, to abuse you. I don’t think these are regulated like bodycams.",1,2026-03-09,augmentedreality,"they are recording you, to abuse you. i don t think these are regulated like bodycams.",KIQ_3_2,"They are recording you, to abuse you. I don’t think these are regulated like bodycams.",True,negative,-0.8,"The comment expresses distrust and fear regarding recording capabilities, which relates to the privacy implications of facial recognition."
o9kmodl,1rp1mpv,"I am just going to leave this here.

https://www.theverge.com/tech/878725/meta-facial-recognition-smart-glasses-name-tag-privacy-advoates?view_token=eyJhbGciOiJIUzI1NiJ9.eyJpZCI6Ilo2dDkxY0dXb0wiLCJwIjoiL3RlY2gvODc4NzI1L21ldGEtZmFjaWFsLXJlY29nbml0aW9uLXNtYXJ0LWdsYXNzZXMtbmFtZS10YWctcHJpdmFjeS1hZHZvYXRlcyIsImV4cCI6MTc3MzUyODYxNiwiaWF0IjoxNzczMDk2NjE2fQ.99PBqfpbn2Ls7jXy83o-ONS19eO84DksiRHveQqvpZw&utm_medium=gift-link",2,2026-03-09,augmentedreality,i am just going to leave this here.,KIQ_3_2,"I am just going to leave this here.

https://www.theverge.com/tech/878725/meta-facial-recognition-smart-glasses-name-tag-privacy-advoates?view_token=eyJhbGciOiJIUzI1NiJ9.eyJpZCI6Ilo2dDkxY0dXb0wiLCJwIjoiL3RlY2gvODc4NzI1L21ldGEtZmFjaWFsLXJlY29nbml0aW9uLXNtYXJ0LWdsYXNzZXMtbmFtZS10YWctcHJpdmFjeS1hZHZvYXRlcyIsImV4cCI6MTc3MzUyODYxNiwiaWF0IjoxNzczMDk2NjE2fQ.99PBqfpbn2Ls7jXy83o-ONS19eO84DksiRHveQqvpZw&utm_medium=gift-link",True,neutral,0.0,The comment links to an article specifically discussing Meta's Name Tag facial recognition feature and privacy.
o9kykbe,1rp1mpv,They’re doxxing people,1,2026-03-09,augmentedreality,they re doxxing people,KIQ_3_2,They’re doxxing people,True,negative,-0.8,The comment implies misuse or privacy violation ('doxxing') related to facial recognition technology.
o9l1pl4,1rp1mpv,"Everyone, for their Palantir mass oppression database.",1,2026-03-10,augmentedreality,"everyone, for their palantir mass oppression database.",KIQ_3_2,"Everyone, for their Palantir mass oppression database.",True,negative,-0.8,"The comment implies the feature is for 'mass oppression,' indicating strong negative sentiment toward the facial recognition aspect."
o9nu2cy,1rp1mpv,Facial detection. ,1,2026-03-10,augmentedreality,facial detection.,KIQ_3_2,Facial detection. ,True,neutral,0.0,"The comment directly mentions 'Facial detection,' which is central to the Name Tag facial recognition feature."
o9p9dqs,1rp1mpv,"Yes. They’re already coordinating with Palantir and are hading over user data on social accounts. They announced that they’re adding facial recognition to the smart glasses. At this point you need to assume that if you’re on a list as someone who opposes ice or this administration, the Feds can query Palantir which has access to social activities and location data that might exist there, live feeds and facial recognition data from license plate reader and Flock cameras, Amazon Ring cameras on your neighbors door, and now Meta smart glasses that some rando (or ice agent) is wearing on the street. ",1,2026-03-10,augmentedreality,"yes. they re already coordinating with palantir and are hading over user data on social accounts. they announced that they re adding facial recognition to the smart glasses. at this point you need to assume that if you re on a list as someone who opposes ice or this administration, the feds can query palantir which has access to social activities and location data that might exist there, live feeds and facial recognition data from license plate reader and flock cameras, amazon ring cameras on your neighbors door, and now meta smart glasses that some rando or ice agent is wearing on the street.",KIQ_3_2,"Yes. They’re already coordinating with Palantir and are hading over user data on social accounts. They announced that they’re adding facial recognition to the smart glasses. At this point you need to assume that if you’re on a list as someone who opposes ice or this administration, the Feds can query Palantir which has access to social activities and location data that might exist there, live feeds and facial recognition data from license plate reader and Flock cameras, Amazon Ring cameras on your neighbors door, and now Meta smart glasses that some rando (or ice agent) is wearing on the street. ",True,negative,-0.9,Expresses deep concern and distrust regarding Meta's facial recognition and data sharing capabilities.
oa4ws7n,1rp1mpv,"Same shit as bodycams, just with head movement",1,2026-03-12,augmentedreality,"same shit as bodycams, just with head movement",KIQ_3_2,"Same shit as bodycams, just with head movement",True,negative,-0.7,"The comment draws a negative comparison to bodycams, implying disapproval of the surveillance aspect of the feature."
oa5b9la,1rs8t2l,Hopefully they get punished for it ,1,2026-03-13,augmentedreality,hopefully they get punished for it,KIQ_3_2,Hopefully they get punished for it ,True,negative,-0.7,"The comment implies disapproval or negative judgment regarding a feature, likely the facial recognition aspect."
oa5osnv,1rs8t2l,"This will get thrown out.

It’s in the terms of service when activate the glasses",18,2026-03-13,augmentedreality,this will get thrown out. it s in the terms of service when activate the glasses,KIQ_3_2,"This will get thrown out.

It’s in the terms of service when activate the glasses",True,negative,-0.3,The comment implies disapproval or skepticism regarding the feature's implementation via the terms of service.
oa5saqy,1rs8t2l,And a lot of that “accidentally” recorded data has likely been sold off to third part data brokers and used to train AI,-1,2026-03-13,augmentedreality,and a lot of that accidentally recorded data has likely been sold off to third part data brokers and used to train ai,KIQ_3_2,And a lot of that “accidentally” recorded data has likely been sold off to third part data brokers and used to train AI,True,negative,-0.7,"It discusses the potential misuse and sale of recorded data, which relates to privacy concerns surrounding facial recognition features."
oa7c4g6,1rs8t2l,How does it relate to third parties? So I can buy these glasses and agree with Meta about accidental activation. But what about people around me that I would be recording?,1,2026-03-13,augmentedreality,how does it relate to third parties? so i can buy these glasses and agree with meta about accidental activation. but what about people around me that i would be recording?,KIQ_3_2,How does it relate to third parties? So I can buy these glasses and agree with Meta about accidental activation. But what about people around me that I would be recording?,True,negative,-0.5,"The user questions privacy implications regarding recording others, directly related to facial recognition features."
oaujnox,1rvbza0,"Peeping?

Explain. ",0,2026-03-17,augmentedreality,peeping? explain.,KIQ_3_2,"Peeping?

Explain. ",True,negative,-0.7,The word 'Peeping?' strongly implies suspicion or discomfort regarding surveillance/facial recognition.
oaway8k,1rvbza0,"RIP to those still wearing Meta glasses. Might as well put a sign on your face that says look at my data. I hope all AI glasses are like Even G2: no camera, just a HUD. The kind you can actually wear everywhere.",1,2026-03-17,augmentedreality,"rip to those still wearing meta glasses. might as well put a sign on your face that says look at my data. i hope all ai glasses are like even g2 no camera, just a hud. the kind you can actually wear everywhere.",KIQ_3_2,"RIP to those still wearing Meta glasses. Might as well put a sign on your face that says look at my data. I hope all AI glasses are like Even G2: no camera, just a HUD. The kind you can actually wear everywhere.",True,negative,-0.7,"The comment expresses strong disapproval of Meta's data collection practices, implying concern over facial recognition features."
oeetkvd,1rvbza0,"This ""pervert glasses"" stigma is exactly why I prefer the Dymesty approach. By physically removing the camera hardware, they made a pair of AI glasses you can actually wear in public or at the office without everyone feeling like they're being ""peeped"" on.",1,2026-04-05,augmentedreality,"this pervert glasses stigma is exactly why i prefer the dymesty approach. by physically removing the camera hardware, they made a pair of ai glasses you can actually wear in public or at the office without everyone feeling like they're being peeped on.",KIQ_3_2,"This ""pervert glasses"" stigma is exactly why I prefer the Dymesty approach. By physically removing the camera hardware, they made a pair of AI glasses you can actually wear in public or at the office without everyone feeling like they're being ""peeped"" on.",True,negative,-0.6,The comment discusses the negative stigma ('pervert glasses') associated with surveillance features like facial recognition.
of6147k,1rvbza0,"This ""pervert glasses"" stigma is exactly why I prefer the Dymesty approach. By physically removing the camera hardware, they made a pair of AI glasses you can actually wear in public or at the office without everyone feeling like they're being ""peeped"" on.",1,2026-04-09,augmentedreality,"this pervert glasses stigma is exactly why i prefer the dymesty approach. by physically removing the camera hardware, they made a pair of ai glasses you can actually wear in public or at the office without everyone feeling like they're being peeped on.",KIQ_3_2,"This ""pervert glasses"" stigma is exactly why I prefer the Dymesty approach. By physically removing the camera hardware, they made a pair of AI glasses you can actually wear in public or at the office without everyone feeling like they're being ""peeped"" on.",True,negative,-0.6,"The comment references the 'pervert glasses' stigma, which is a direct reaction to facial recognition/camera features like Name Tag."
ob9s9ld,1rx4wiu,Facial recognition on glasses just sounds like a privacy nightmare 😬,1,2026-03-19,augmentedreality,facial recognition on glasses just sounds like a privacy nightmare,KIQ_3_2,Facial recognition on glasses just sounds like a privacy nightmare 😬,True,negative,-0.7,Directly expresses concern about the privacy implications of facial recognition on glasses.
nn1e4gf,1oo468c,"Related article here:https://people.com/university-issues-warning-after-reports-of-man-using-ray-ban-meta-sunglasses-to-record-women-on-campus-11824196?  
And here’s the charging stand I mentioned: [https://www.amazon.com/dp/B0FJ1QKVBZ?maas=maas\_adg\_1F6A2F2F621C125F3E4FD32BBD4787AC\_afap\_abs&ref\_=aa\_maas&tag=maas&th=1](https://www.amazon.com/dp/B0FJ1QKVBZ?maas=maas_adg_1F6A2F2F621C125F3E4FD32BBD4787AC_afap_abs&ref_=aa_maas&tag=maas&th=1)",-3,2025-11-04,RaybanMeta,related article here and here s the charging stand i mentioned,KIQ_3_2,"Related article here:https://people.com/university-issues-warning-after-reports-of-man-using-ray-ban-meta-sunglasses-to-record-women-on-campus-11824196?  
And here’s the charging stand I mentioned: [https://www.amazon.com/dp/B0FJ1QKVBZ?maas=maas\_adg\_1F6A2F2F621C125F3E4FD32BBD4787AC\_afap\_abs&ref\_=aa\_maas&tag=maas&th=1](https://www.amazon.com/dp/B0FJ1QKVBZ?maas=maas_adg_1F6A2F2F621C125F3E4FD32BBD4787AC_afap_abs&ref_=aa_maas&tag=maas&th=1)",True,negative,-0.7,"The linked article discusses misuse of the glasses for recording, implying privacy concerns related to facial recognition."
nn1gj6x,1oo468c,"Like what, theres no expectation of privacy in public.",5,2025-11-04,RaybanMeta,"like what, theres no expectation of privacy in public.",KIQ_3_2,"Like what, theres no expectation of privacy in public.",True,negative,-0.5,"The comment implies a lack of privacy concern regarding public surveillance, which relates to facial recognition features."
nrs7pr5,1pbnmx3,"They definitely arnt removing it because they are partnering up with the live-streaming service Twitch.

https://preview.redd.it/hx1835px0o4g1.jpeg?width=1179&format=pjpg&auto=webp&s=032cd938120e6e63ea13e33f088b8cd0011032a1",15,2025-12-01,RaybanMeta,they definitely arnt removing it because they are partnering up with the live-streaming service twitch.,KIQ_3_2,"They definitely arnt removing it because they are partnering up with the live-streaming service Twitch.

https://preview.redd.it/hx1835px0o4g1.jpeg?width=1179&format=pjpg&auto=webp&s=032cd938120e6e63ea13e33f088b8cd0011032a1",True,neutral,0.1,It discusses the persistence of a feature (implied to be related to identification/recognition) due to a partnership.
nx0quaj,1q0srds,then that falls under discrimation.  this probably won't be settled until there is case law on it and i'm guessing ads will win considering the bright ass light in the metas.,6,2026-01-01,RaybanMeta,then that falls under discrimation. this probably won't be settled until there is case law on it and i'm guessing ads will win considering the bright ass light in the metas.,KIQ_3_2,then that falls under discrimation.  this probably won't be settled until there is case law on it and i'm guessing ads will win considering the bright ass light in the metas.,True,negative,-0.6,The comment discusses discrimination related to the feature and predicts negative outcomes (ads winning).
nyg3d3r,1q7g4rj,"I honestly think the ""creep"" factor is psychological( unless you got a color where the cameras stand out 100% more). Really....how many people are looking you dead in the face to notice cameras in your glasses( I'm sure as fuck not)...they literally have to invade your private space to even see. Ive had to explain to too many people why Im putting my glasses in the bin with my electronics",1,2026-01-08,RaybanMeta,i honestly think the creep factor is psychological unless you got a color where the cameras stand out 100 more . really....how many people are looking you dead in the face to notice cameras in your glasses i'm sure as fuck not ...they literally have to invade your private space to even see. ive had to explain to too many people why im putting my glasses in the bin with my electronics,KIQ_3_2,"I honestly think the ""creep"" factor is psychological( unless you got a color where the cameras stand out 100% more). Really....how many people are looking you dead in the face to notice cameras in your glasses( I'm sure as fuck not)...they literally have to invade your private space to even see. Ive had to explain to too many people why Im putting my glasses in the bin with my electronics",True,negative,-0.6,The user expresses discomfort and a 'creep' factor regarding the presence of cameras/facial recognition in glasses.
